{
  "schemaVersion": "0.1.0",
  "id": "vrm1-humanoid.default",
  "rig": "vrm-humanoid",
  "capability": "full",
  "bones": {
    "left": {
      "wrist": "leftHand",
      "shoulder": "leftUpperArm",
      "elbow": "leftLowerArm",
      "fingers": {
        "thumbCmc": "leftThumbMetacarpal",
        "thumbMcp": "leftThumbProximal",
        "thumbIp": "leftThumbDistal",
        "indexMcp": "leftIndexProximal",
        "indexPip": "leftIndexIntermediate",
        "indexDip": "leftIndexDistal",
        "middleMcp": "leftMiddleProximal",
        "middlePip": "leftMiddleIntermediate",
        "middleDip": "leftMiddleDistal",
        "ringMcp": "leftRingProximal",
        "ringPip": "leftRingIntermediate",
        "ringDip": "leftRingDistal",
        "littleMcp": "leftLittleProximal",
        "littlePip": "leftLittleIntermediate",
        "littleDip": "leftLittleDistal"
      }
    },
    "right": {
      "wrist": "rightHand",
      "shoulder": "rightUpperArm",
      "elbow": "rightLowerArm",
      "fingers": {
        "thumbCmc": "rightThumbMetacarpal",
        "thumbMcp": "rightThumbProximal",
        "thumbIp": "rightThumbDistal",
        "indexMcp": "rightIndexProximal",
        "indexPip": "rightIndexIntermediate",
        "indexDip": "rightIndexDistal",
        "middleMcp": "rightMiddleProximal",
        "middlePip": "rightMiddleIntermediate",
        "middleDip": "rightMiddleDistal",
        "ringMcp": "rightRingProximal",
        "ringPip": "rightRingIntermediate",
        "ringDip": "rightRingDistal",
        "littleMcp": "rightLittleProximal",
        "littlePip": "rightLittleIntermediate",
        "littleDip": "rightLittleDistal"
      }
    },
    "face": {
      "head": "head",
      "jaw": "jaw"
    }
  },
  "rangeOfMotion": {
    "wrist": {
      "x": [
        -70,
        70
      ],
      "y": [
        -90,
        90
      ],
      "z": [
        -30,
        30
      ]
    },
    "elbow": {
      "x": [
        0,
        145
      ]
    },
    "shoulder": {
      "x": [
        -90,
        90
      ],
      "y": [
        -90,
        90
      ],
      "z": [
        -90,
        90
      ]
    },
    "thumbCmc": {
      "x": [
        0,
        100
      ],
      "z": [
        -15,
        15
      ]
    },
    "thumbMcp": {
      "x": [
        -20,
        90
      ],
      "z": [
        -15,
        15
      ]
    },
    "thumbIp": {
      "x": [
        0,
        100
      ],
      "z": [
        -15,
        15
      ]
    },
    "indexMcp": {
      "x": [
        -20,
        90
      ],
      "z": [
        -15,
        15
      ]
    },
    "indexPip": {
      "x": [
        0,
        100
      ],
      "z": [
        -15,
        15
      ]
    },
    "indexDip": {
      "x": [
        0,
        100
      ],
      "z": [
        -15,
        15
      ]
    },
    "middleMcp": {
      "x": [
        -20,
        90
      ],
      "z": [
        -15,
        15
      ]
    },
    "middlePip": {
      "x": [
        0,
        100
      ],
      "z": [
        -15,
        15
      ]
    },
    "middleDip": {
      "x": [
        0,
        100
      ],
      "z": [
        -15,
        15
      ]
    },
    "ringMcp": {
      "x": [
        -20,
        90
      ],
      "z": [
        -15,
        15
      ]
    },
    "ringPip": {
      "x": [
        0,
        100
      ],
      "z": [
        -15,
        15
      ]
    },
    "ringDip": {
      "x": [
        0,
        100
      ],
      "z": [
        -15,
        15
      ]
    },
    "littleMcp": {
      "x": [
        -20,
        90
      ],
      "z": [
        -15,
        15
      ]
    },
    "littlePip": {
      "x": [
        0,
        100
      ],
      "z": [
        -15,
        15
      ]
    },
    "littleDip": {
      "x": [
        0,
        100
      ],
      "z": [
        -15,
        15
      ]
    }
  },
  "restPoseCorrection": {
    "leftUpperArm": [
      0,
      0,
      -60
    ],
    "rightUpperArm": [
      0,
      0,
      60
    ]
  }
}
